{
  "$schema": "https://json-schema.org/draft/2020-12/schema",
  "$id": "https://evidencegate.local/auditors/problem-evidence/gate2a-p/schema/lifecycle-state.schema.json",
  "title": "Gate 2A-P Lifecycle Dimensions",
  "description": "Independent dimensions. Formal acceptance is deliberately absent as a repository state.",
  "type": "object",
  "additionalProperties": false,
  "properties": {
    "packageId": {
      "const": "gate2a-p-lifecycle-state"
    },
    "contractVersion": {
      "const": "0.13.0-draft"
    },
    "designReview": {
      "type": "object",
      "additionalProperties": false,
      "properties": {
        "currentState": {
          "const": "pending-owner-review"
        },
        "allowedStates": {
          "const": [
            "drafted",
            "reviewed",
            "design-approved",
            "superseded"
          ]
        },
        "stateHeldExternally": {
          "const": true
        },
        "note": {
          "type": "string",
          "minLength": 1
        }
      },
      "required": [
        "currentState",
        "allowedStates",
        "stateHeldExternally",
        "note"
      ]
    },
    "operationalComparatorUse": {
      "type": "object",
      "additionalProperties": false,
      "properties": {
        "currentState": {
          "const": "prohibited"
        },
        "allowedStates": {
          "const": [
            "prohibited",
            "permitted"
          ]
        },
        "changeableByGate2AP": {
          "const": false
        },
        "note": {
          "type": "string",
          "minLength": 1
        }
      },
      "required": [
        "currentState",
        "allowedStates",
        "changeableByGate2AP",
        "note"
      ]
    },
    "runtimeEnforcement": {
      "type": "object",
      "additionalProperties": false,
      "properties": {
        "currentState": {
          "const": "disabled"
        },
        "allowedStates": {
          "const": [
            "disabled",
            "enabled"
          ]
        },
        "changeableByGate2AP": {
          "const": false
        },
        "authorizingGate": {
          "const": "Gate 2B"
        }
      },
      "required": [
        "currentState",
        "allowedStates",
        "changeableByGate2AP",
        "authorizingGate"
      ]
    },
    "modelCompatibility": {
      "type": "object",
      "additionalProperties": false,
      "properties": {
        "currentState": {
          "const": "unresolved-offline"
        },
        "changeableByGate2AP": {
          "const": false
        },
        "authorizingGate": {
          "const": "Gate 2C"
        }
      },
      "required": [
        "currentState",
        "changeableByGate2AP",
        "authorizingGate"
      ]
    },
    "formalPhase1Acceptance": {
      "type": "object",
      "additionalProperties": false,
      "properties": {
        "representedAsRepositoryState": {
          "const": false
        },
        "requires": {
          "const": "detached external authority"
        },
        "cannotBeConferredBy": {
          "type": "array",
          "minItems": 6,
          "items": {
            "type": "string",
            "minLength": 1
          }
        }
      },
      "required": [
        "representedAsRepositoryState",
        "requires",
        "cannotBeConferredBy"
      ]
    },
    "crossDimensionalInvariants": {
      "type": "array",
      "minItems": 6,
      "items": {
        "type": "object",
        "additionalProperties": false,
        "properties": {
          "id": {
            "type": "string",
            "pattern": "^X-[0-9]+$"
          },
          "invariant": {
            "type": "string",
            "minLength": 1
          },
          "enforcedBy": {
            "enum": [
              "json-schema",
              "deterministic-cross-document",
              "human-review"
            ]
          }
        },
        "required": [
          "id",
          "invariant",
          "enforcedBy"
        ]
      }
    }
  },
  "required": [
    "packageId",
    "contractVersion",
    "designReview",
    "operationalComparatorUse",
    "runtimeEnforcement",
    "modelCompatibility",
    "formalPhase1Acceptance",
    "crossDimensionalInvariants"
  ]
}
